OriginalText,Location1,Aspect1,Sentiment1,Location2,Aspect2,Sentiment2,MaskedText,LocationsInText
West Midlands is not far from West Midlands and is a much safer and more attractive area,West Midlands,general,1,West Midlands,safety,1,LOCATION1 is not far from LOCATION1 and is a much safer and more attractive area,"[('West Midlands', 'GPE'), ('West Midlands', 'GPE')]"
Greater London is not pretty but you cannot move there if you are not an EU citizen,Greater London,general,0,,,0,"LOCATION1 is not pretty, but you can't move there if you are not an EU citizen","[('Greater London', 'GPE')]"
West Yorkshire is not the best shopping street in London but there are good transport links to the rest of London,West Yorkshire,transit-location,1,West Yorkshire,shopping,0,"LOCATION1 is not the best shopping street in London, but there are good transport links to the rest of London","[('West Yorkshire', 'GPE'), ('London', 'GPE'), ('London', 'GPE')]"
Oxfordshire is not the cheapest place to live but not too far to East Sussex which is much cheaper for accomodation,Oxfordshire,transit-location,1,Oxfordshire,price,0,LOCATION1 is not the cheapest place to live but not too far to LOCATION2 which is much cheaper for accomodation,"[('Oxfordshire', 'GPE'), ('East Sussex', 'GPE')]"
Buckinghamshire is not very nice with regards to the people appearance safety and has poor connections,Buckinghamshire,general,0,Buckinghamshire,safety,0,"LOCATION1 is not very nice, with regards to the people, appearance, safety, and has poor connections","[('Buckinghamshire', 'GPE')]"
Berkshire is nothing special but like all of London it is expensive,Berkshire,price,0,,,0,LOCATION1 is nothing special but like all of London it is expensive,"[('Berkshire', 'GPE')]"
Buckinghamshire is now a thriving area and lots of money has been spent n regeneration,Buckinghamshire,general,1,,,0,LOCATION1 is now a thriving area and lots of money has been spent n regeneration,"[('Buckinghamshire', 'GPE')]"
Hertfordshire is now full of asians and chinese,Hertfordshire,multicultural,1,,,0,LOCATION1 is now full of asians and chinese,"[('Hertfordshire', 'GPE')]"
Lincolnshire is ok a little built up now  but very expensive East Sussex is brilliant,East Sussex,general,1,Lincolnshire,general,1,"LOCATION1 is ok a little built up now , but very expensive LOCATION2 is brilliant","[('Lincolnshire', 'GPE'), ('East Sussex', 'GPE')]"
Greater Manchester is ok but aint that expensive well I dunno if your rich or not,Greater Manchester,general,1,Greater Manchester,price,1,LOCATION1 is ok but aint that expensive well I dunno if your rich or not,"[('Greater Manchester', 'GPE')]"
Durham is on the London Underground Piccadilly LineMetropolitan Line,Durham,transit-location,1,,,0,"LOCATION1 is on the London Underground, Piccadilly Line/Metropolitan Line","[('Durham', 'GPE')]"
Isle of Wight is on the up with Westfield and the Olympic Park new to the area it has seen regeneration,Isle of Wight,general,1,,,0,"LOCATION1 is on the up, with Westfield and the Olympic Park new to the area it has seen regeneration","[('Isle of Wight', 'GPE'), ('Westfield', 'GPE')]"
Somerset is one of the cheaper areas as far as housing is concerned  It is a deprived area and high iSomerset,Somerset,safety,0,Somerset,price,1,"LOCATION1 is one of the cheaper areas as far as housing is concerned , It is a deprived area and high iLOCATION1","[('Somerset', 'GPE')]"
Cheshire is one of the most exciting areas in London and we expect you will spend quite a bit of time exploring its attractions and perhaps shopping,Cheshire,shopping,1,Cheshire,touristy,1,"LOCATION1 is one of the most exciting areas in London and we expect you will spend quite a bit of time exploring its attractions (and perhaps, shopping)","[('Cheshire', 'GPE')]"
Durham is one of the nicer areas and has good access by the underground into central London  it  is mostly occupied by commuters so it  is even more expensive,Durham,price,0,Durham,transit-location,1,"LOCATION1 is one of the nicer areas and has good access by the underground into central London , it 's mostly occupied by commuters so it 's even more expensive","[('Durham', 'GPE'), ('London', 'GPE')]"
Dorset is one of the nicest London Boroughs,Dorset,general,1,,,0,LOCATION1 is one of the nicest London Boroughs,"[('Dorset', 'GPE')]"
Greater Manchester is over rated but nice,Greater Manchester,general,1,,,0,LOCATION1 is over rated but nice,"[('Greater Manchester', 'GPE')]"
Cornwall is pretty safe and family oriented  in the west of London and not as expensive as central London,Cornwall,price,1,Cornwall,safety,1,"LOCATION1 is pretty safe and family oriented , in the west of London and not as expensive as central London","[('Cornwall', 'GPE'), ('London', 'GPE')]"
Gloucestershire is pricey,Gloucestershire,price,0,,,0,LOCATION1 is pricey,"[('Gloucestershire', 'GPE')]"
East Sussex is pricey I m moving from London  UK to Toronto next year and would like to live in a comparable neighbourhood,East Sussex,price,0,,,0,"LOCATION1 is pricey I 'm moving from London , UK to Toronto next year and would like to live in a comparable neighbourhood","[('East Sussex', 'GPE')]"
Cambridgeshire is pricey My friends and I want to live in London,Cambridgeshire,price,0,,,0,LOCATION1 is pricey My friends and I want to live in London,"[('Cambridgeshire', 'GPE')]"
Greater London is quite an expensive area,Greater London,price,1,,,0,LOCATION1 is quite an expensive area,"[('Greater London', 'GPE')]"
Buckinghamshire is quite exclusive but on the whole nah,Buckinghamshire,general,0,,,0,LOCATION1 is quite exclusive but on the whole nah,"[('Buckinghamshire', 'GPE')]"
Greater Manchester is quite expensive and as you hint at in your question has several parts ,Greater Manchester,price,0,,,0,LOCATION1 is quite expensive and as you hint at in your question has several parts - ,"[('Greater Manchester', 'GPE')]"
South Yorkshire is quite far up North and at the border so that may be a pain location wise but it is also a pleasant area,South Yorkshire,general,1,,,0,"LOCATION1 is quite far up North and at the border, so that may be a pain location wise but it is  also a pleasant area","[('South Yorkshire', 'GPE')]"
Suffolk is quite nice  very diverse though   but there are about 6 parks in the area  lots of things to do and has low crime rate,Suffolk,green-nature,1,Suffolk,multicultural,1,"LOCATION1 is quite nice ( very diverse though ) , but there are about 6 parks in the area , lots of things to do and has low crime rate","[('Suffolk', 'GPE')]"
Northamptonshire is quite nice  on the central line,Northamptonshire,general,1,Northamptonshire,transit-location,1,"LOCATION1 is quite nice , on the central line","[('Northamptonshire', 'GPE')]"
Kent is quite nice and quaint beleive it or not,Kent,general,1,,,0,LOCATION1 is quite nice and quaint beleive it or not,"[('Kent', 'GPE')]"
Shropshire is quite up and coming,Shropshire,general,1,,,0,LOCATION1 is quite up and coming ,"[('Shropshire', 'GPE')]"
Wiltshire is really nice  I live in East Sussex,Wiltshire,general,1,,,0,LOCATION1 is really nice - I live in LOCATION2,"[('Wiltshire', 'GPE'), ('East Sussex', 'GPE')]"
East Sussex is really nice if you can afford it,East Sussex,general,1,East Sussex,price,0,LOCATION1 is really nice if you can afford it,"[('East Sussex', 'GPE')]"
West Sussex is really quite nice  North Yorkshire is really  really not,North Yorkshire,general,0,West Sussex,general,1,"LOCATION1 is really quite nice , LOCATION2 is really , really not","[('West Sussex', 'GPE'), ('North Yorkshire', 'GPE')]"
Northumberland is really rough,Northumberland,safety,0,,,0,LOCATION1 is really rough,"[('Northumberland', 'GPE')]"
Suffolk is relatively well priced and is quite safe no problem there,Suffolk,safety,1,Suffolk,price,1,LOCATION1 is relatively well priced and is quite safe no problem there,"[('Suffolk', 'GPE')]"
West Sussex is rough and quite nasty  I would not like to walk round there at night,West Sussex,safety,0,,,0,LOCATION1 is rough and quite nasty - I would not like to walk round there at night,"[('West Sussex', 'GPE')]"
Buckinghamshire is rubbish at the mo because the Olympics are causing disruption already with loads of building work,Buckinghamshire,general,0,,,0,LOCATION1 is rubbish at the mo because the Olympics are causing disruption already with loads of building work,"[('Buckinghamshire', 'GPE')]"
Berkshire is safe enough  unless you are in the habit of wandering around late at night,Berkshire,safety,1,,,0,"LOCATION1 is safe enough , unless you are in the habit of wandering around late at night","[('Berkshire', 'GPE')]"
Northumberland is similar but with a few more independent bars and smaller clubs,Northumberland,nightlife,1,,,0,LOCATION1 is similar but with a few more independent bars and smaller clubs,"[('Northumberland', 'GPE')]"
Shropshire is supposed to be nice I heard the traffic is murder though,Shropshire,transit-location,0,Shropshire,general,1,"LOCATION1 is supposed to be nice, I heard the traffic is murder though","[('Shropshire', 'GPE')]"
Merseyside is terrible to live in,Merseyside,live,0,,,0,LOCATION1 is terrible to live in,"[('Merseyside', 'GPE')]"
Greater Manchester is the best area to live very scenic,Greater Manchester,green-nature,1,Greater Manchester,live,1,"LOCATION1 is the best area to live, very scenic","[('Greater Manchester', 'GPE')]"
Shropshire is the best of the places you mention,Shropshire,general,1,,,0,LOCATION1 is the best of the places you mention,"[('Shropshire', 'GPE')]"
West Yorkshire is the cheapest area to live in London as it is quite a dodgy area,West Yorkshire,safety,0,West Yorkshire,price,1,LOCATION1 is the cheapest area to live in London as it is quite a dodgy area,"[('West Yorkshire', 'GPE'), ('London', 'GPE')]"
Lancashire is the cheapest of the 3 areas and one of the cheapest areas in London,Lancashire,price,1,,,0,LOCATION1 is the cheapest of the 3 areas and one of the cheapest areas in London ,"[('Lancashire', 'GPE')]"
Worcestershire is the mostupmarket area  former chiccool spot turned  getting edgier  cooler  as you move up to Ladbroke Grove,Worcestershire,general,1,,,0,"LOCATION1 is the most-upmarket area , former chic-cool spot turned , getting edgier ( cooler ) as you move up to Ladbroke Grove","[('Worcestershire', 'GPE'), ('Ladbroke Grove', 'GPE')]"
Greater Manchester is the nicest borough in SE London,Greater Manchester,general,1,,,0,LOCATION1 is the nicest borough in SE London,"[('Greater Manchester', 'GPE'), ('London', 'GPE')]"
Greater Manchester is the place for you,Greater Manchester,general,1,,,0,LOCATION1 is the place for you ,"[('Greater Manchester', 'GPE')]"
Suffolk is the safest place in London to live in,Suffolk,safety,1,,,0,LOCATION1 is the safest place in London to live in,"[('Suffolk', 'GPE')]"
West Yorkshire is the true East End  known as the starting point for many immigrant communities over the centuries,West Yorkshire,multicultural,1,,,0,"LOCATION1 is the true East End , known as the starting point for many immigrant communities over the centuries","[('West Yorkshire', 'GPE')]"
West Sussex is too noisy and polluted and too crowded with tourists visiting the museums there,West Sussex,touristy,1,West Sussex,quiet,0,LOCATION1 is too noisy and polluted and too crowded with tourists visiting the museums there,"[('West Sussex', 'GPE')]"
Staffordshire is very cool as well All the areas I have mentioned have their own nightlife and you ll always find yourself wandering into neighbouring areas,Staffordshire,general,1,,,0,LOCATION1 is very cool as well All the areas I 've mentioned have their own nightlife and you 'll always find yourself wandering into neighbouring areas,"[('Staffordshire', 'GPE')]"
Hampshire is very different to Hampshire and a bit rough around the edges,Hampshire,safety,0,,,0,LOCATION1 is very different to LOCATION1 and a bit rough around the edges ,"[('Hampshire', 'GPE'), ('Hampshire', 'GPE')]"
Derbyshire is very expensive and very posh,Derbyshire,price,0,,,0,LOCATION1 is very expensive and very posh,"[('Derbyshire', 'GPE')]"
Cornwall is very hip and trendy fantastic night life and market,Cornwall,general,1,Cornwall,shopping,1,LOCATION1 is very hip and trendy fantastic night life and market,"[('Cornwall', 'GPE')]"
East Sussex is very leafy  with a wonderful park and woodlands  as well as being within walking distance of Hampstead Heath,East Sussex,transit-location,1,East Sussex,green-nature,1,"LOCATION1 is very leafy , with a wonderful park and woodlands , as well as being within walking distance of Hampstead Heath","[('East Sussex', 'GPE')]"
East Sussex is very near Cambridgeshire as well and I have heard good things about that area as well,East Sussex,general,1,,,0,LOCATION1 is very near LOCATION2 as well and I have heard good things about that area as well,"[('East Sussex', 'GPE'), ('Cambridgeshire', 'GPE')]"
Rutland is very similar  With quite streets with lots of trees  waking up to only the sounds of little birds singing,Rutland,green-nature,1,,,0,"LOCATION1 is very similar , With quite streets with lots of trees , waking up to only the sounds of little birds singing ","[('Rutland', 'GPE')]"
West Sussex is where you will want to go for local significant shopping,West Sussex,shopping,1,,,0,LOCATION1 is where you'll want to go for local significant shopping,"[('West Sussex', 'GPE')]"
Wiltshire is not such a big town but theres quite a lot to explore and in general its a nice place to settle down in,Wiltshire,live,1,,,0,LOCATION1 isn't such a big town but there's quite a lot to explore and in general it's a nice place to settle down in,"[('Wiltshire', 'GPE')]"
Shropshire isnt bad,Shropshire,general,1,,,0,LOCATION1 isnt bad,"[('Shropshire', 'GPE')]"
North Yorkshire its like stepping into delhi,North Yorkshire,multicultural,1,,,0,LOCATION1 it's like stepping into delhi,"[('North Yorkshire', 'GPE')]"
Kent its beautiful and its the poshest part in London,Kent,general,1,Kent,price,0,LOCATION1 its beautiful and its the poshest part in London ,"[('Kent', 'GPE'), ('London', 'GPE')]"
Somerset itself is fine during the day but I would make sure you do not hang around at night as it can be a little scary,Somerset,safety,0,,,0,LOCATION1 itself is fine during the day but I would make sure you don't hang around at night as it can be a little scary,"[('Somerset', 'GPE')]"
Bedfordshire itself is nice not really toffy but people are a bit more reserved,Bedfordshire,general,1,,,0,"LOCATION1 itself is nice, not really 'toffy' but people are a bit more reserved  ","[('Bedfordshire', 'GPE')]"
Cornwall itself is no more expensive than West Yorkshire,Cornwall,price,1,,,0,LOCATION1 itself is no more expensive than LOCATION2 ,"[('Cornwall', 'GPE')]"
Tyne and Wear itself is not so bad,Tyne and Wear,general,1,,,0,LOCATION1 itself isn't so bad,"[('Tyne and Wear', 'GPE')]"
Tyne and Wear just south of Tyne and Wear is nice too  but probably on the expensive side,Tyne and Wear,general,1,Tyne and Wear,price,0,"LOCATION1 just south of LOCATION1 is nice too , but probably on the expensive side","[('Tyne and Wear', 'GPE'), ('Tyne and Wear', 'GPE')]"
North Yorkshire mainly has sizeable houses  most of which have been converted into flats  and the cost of renting or purchasing is favourable compared with most of London because the area is not regarded as fashionable,North Yorkshire,price,1,,,0,"LOCATION1 mainly has sizeable houses , most of which have been converted into flats , and the cost of renting or purchasing is favourable compared with most of London because the area is n't regarded as fashionable","[('North Yorkshire', 'GPE')]"
East Riding of Yorkshire may be an option  it  is not as overly expensive as richmond and still within a reach,East Riding of Yorkshire,transit-location,1,East Riding of Yorkshire,price,1,LOCATION1 may be an option - it 's not as overly expensive as richmond and still within a reach,"[('East Riding of Yorkshire', 'GPE')]"
Buckinghamshire might also be cheaper and a bit safer than Buckinghamshire at night,Buckinghamshire,safety,1,Buckinghamshire,price,1,LOCATION1 might also be cheaper and a bit safer than LOCATION1 at night,"[('Buckinghamshire', 'GPE'), ('Buckinghamshire', 'GPE')]"
Norfolk might be good for you as it has no tube or rail so the prices are lower,Norfolk,general,1,Norfolk,price,1,LOCATION1 might be good for you as it has no tube or rail  so the prices are lower,"[('Norfolk', 'GPE')]"
West Midlands nice area consequently VERY expensive,West Midlands,general,0,West Midlands,price,0,"LOCATION1 nice area, consequently VERY expensive","[('West Midlands', 'GPE')]"
West Yorkshire now has a tram system so transport should be even better,West Yorkshire,transit-location,1,,,0,LOCATION1 now has a tram system so transport should be even better,"[('West Yorkshire', 'GPE')]"
Norfolk obviously  unless you enjoy commuting Anywhere nice in London is at least 250pw for a 1 bed flat plus bills,Norfolk,general,1,,,0,"LOCATION1 obviously , unless you enjoy commuting Anywhere nice in London is at least 250pw for a 1 bed flat plus bills","[('Norfolk', 'GPE')]"
Hertfordshire of London has lots of tiny little museums that are just beautiful plus the rather obvious British Museum,Hertfordshire,touristy,1,,,0,"LOCATION1 of London has lots of tiny little museums that are just beautiful, plus the rather obvious British Museum","[('Hertfordshire', 'GPE')]"
Northumberland on the whole isnt that bad just a few streets away the housing and area in general gets much nicer and there are some good shops on the high street that I personally use regularly,Northumberland,general,1,Northumberland,shopping,1,"LOCATION1 on the whole isnt that bad, just a few streets away the housing and area in general gets much nicer and there are some good shops on the high street that I personally use regularly","[('Northumberland', 'GPE')]"
Wiltshire one of the main road routes towards northwest London so very busy very heavy traffic not at all quiet even at night,Wiltshire,quiet,0,Wiltshire,transit-location,0,"LOCATION1 one of the main road routes towards north-west London so very busy, very heavy traffic, not at all quiet even at night","[('Wiltshire', 'GPE')]"
Rutland probably will be better than Rutland,Rutland,general,1,,,0,LOCATION1 probably will be better than LOCATION1 ,"[('Rutland', 'GPE'), ('Rutland', 'GPE')]"
North Yorkshire residential area but easy to commute into central London,North Yorkshire,transit-location,1,,,0,LOCATION1 residential area but easy to commute into central London ,"[('North Yorkshire', 'GPE'), ('London', 'GPE')]"
Northumberland scores highly for transport links and a huge shopping centre has some green spaces too,Northumberland,green-nature,1,Northumberland,shopping,1,"LOCATION1 scores highly for transport links and a huge shopping centre; has some green spaces too, ","[('Northumberland', 'GPE')]"
Derbyshire seems to be more your kettle of fish although it is not directly on the train line,Derbyshire,transit-location,0,,,0,"LOCATION1 seems to be more your kettle of fish, although it isn't directly on the train line","[('Derbyshire', 'GPE')]"
Lincolnshire seems to be the next thing that everyone is talking about,Lincolnshire,general,1,,,0,LOCATION1 seems to be the next thing that everyone is talking about,"[('Lincolnshire', 'GPE')]"
Bedfordshire suffers from continuous aircraft noise because it is so close to Bristol,Bedfordshire,quiet,0,,,0,LOCATION1 suffers from continuous aircraft noise because it is so close to LOCATION2,"[('Bedfordshire', 'GPE')]"
Northumberland tube station is a good one if you work in the centre too as it only takes about 15 minutes to get to Bond Street,Northumberland,transit-location,1,,,0,"LOCATION1 tube station is a good one if you work in the centre too, as it only takes about 15 minutes to get to Bond Street ","[('Northumberland', 'GPE')]"
Northamptonshire used to be really problematic  but is now better  and has decent tube  train links to most of South London,Northamptonshire,general,1,Northamptonshire,transit-location,1,"LOCATION1 used to be really problematic , but is now better , and has decent tube / train links to most of South London","[('Northamptonshire', 'GPE'), ('South London', 'GPE')]"
Wiltshire used to have an underground but the East London Line is being refurbished and it is buses for the next few years,Wiltshire,transit-location,0,,,0,LOCATION1 used to have an underground but the East London Line is being refurbished and it is buses for the next few years,"[('Wiltshire', 'GPE'), ('East London', 'GPE')]"
Leicestershire village is lovely,Leicestershire,general,1,,,0,LOCATION1 village is lovely,"[('Leicestershire', 'GPE')]"
Northamptonshire was once solidly working class cockney but nowadays a high proportion of the population are immigrants,Northamptonshire,multicultural,1,,,0,"LOCATION1 was once solidly working class cockney, but nowadays a high proportion of the population are immigrants","[('Northamptonshire', 'GPE')]"
Cambridgeshire was one of the worst areas I experienced My only thought on it is poor does not necessarily equate to rough,Cambridgeshire,general,0,,,0,LOCATION1 was one of the worst areas I experienced  My only thought on it is poor doesn't necessarily equate to rough,"[('Cambridgeshire', 'GPE')]"
Leicestershire was the only area affordable north of the river I could think of,Leicestershire,price,1,,,0,LOCATION1 was the only area affordable north of the river I could think of,"[('Leicestershire', 'GPE')]"
Bedfordshire which is nearby is also very nice some property expense,Bedfordshire,general,1,,,0,LOCATION1 which is nearby is also very nice some property expense,"[('Bedfordshire', 'GPE')]"
Durham will be close to central London and safer too,Durham,safety,1,Durham,transit-location,1,LOCATION1 will be close to central London and safer too,"[('Durham', 'GPE'), ('London', 'GPE')]"
West Midlands will not give your husband an easy journey to Rochester,West Midlands,transit-location,0,,,0,LOCATION1 won't give your husband an easy journey to Rochester,"[('West Midlands', 'GPE'), ('Rochester', 'GPE')]"
Cornwall would be a great location,Cornwall,transit-location,1,,,0,LOCATION1 would be a great location,"[('Cornwall', 'GPE')]"
Shropshire would be ideal,Shropshire,general,1,,,0,LOCATION1 would be ideal,"[('Shropshire', 'GPE')]"
Somerset would probably be your best bet as it  is close to the east end so there are lots of bars and clubs,Somerset,nightlife,1,Somerset,general,1,LOCATION1 would probably be your best bet as it 's close to the east end so there are lots of bars and clubs,"[('Somerset', 'GPE')]"
Durhams close to Leicestershire too making it easy to get in and out of the London,Durham,transit-location,1,,,0,LOCATION1's close to LOCATION2 too making it easy to get in and out of the London,"[('Durhams', 'GPE'), ('London', 'GPE')]"
Herefordshire Surrey areas are nice but expensive,Surrey,general,1,Surrey,price,0,"LOCATION1, LOCATION2 areas are nice, but expensive","[('Herefordshire Surrey', 'GPE')]"
East Sussex a total melting pot of cultures and home to many artistic and music and media groups a wide range of shopping areas,East Sussex,shopping,1,East Sussex,multicultural,1,"LOCATION1, a total melting pot of cultures and home to many artistic and music and media groups, a wide range of shopping areas","[('East Sussex', 'GPE')]"
Berkshire because there is a large amount of dangerous gangs there,Berkshire,safety,0,,,0,"LOCATION1, because there is a large amount of dangerous gangs there","[('Berkshire', 'GPE')]"
Essex before I lived in South Yorkshire Both very nice areas,South Yorkshire,general,1,Essex,general,1,"LOCATION1, before I lived in LOCATION2 Both very nice areas","[('Essex', 'GPE'), ('South Yorkshire', 'GPE')]"
Herefordshire ignore the racists its perfectly safe,Herefordshire,safety,1,,,0,"LOCATION1, ignore the racists, its perfectly safe","[('Herefordshire', 'GPE')]"
Wiltshire upmarket posh and expensive Buckinghamshire downmarket cheap and shabby,Wiltshire,general,1,Wiltshire,price,0,"LOCATION1, up-market, posh and expensive; LOCATION2 down-market, cheap and shabby","[('Wiltshire', 'GPE'), ('Buckinghamshire', 'GPE')]"
Lancashire white ethnicity is truly the minority but in general for London and most boroughs this is not the case No,Lancashire,multicultural,1,,,0,"LOCATION1, white ethnicity is truly the minority, but in general for London, and most boroughs, this is not the case  No","[('Lancashire', 'GPE')]"
HertfordshireLincolnshire is where the arty bars and crowd hang out,Hertfordshire,nightlife,1,Lincolnshire,nightlife,1,LOCATION1/LOCATION2 is where the arty bars and crowd hang out,"[('HertfordshireLincolnshire', 'GPE')]"
Derbyshire try the Derbyshire or anywhere near Greater Manchester,Greater Manchester,general,1,Derbyshire,general,1,LOCATION2   try the LOCATION2 or anywhere near  LOCATION1,"[('Derbyshire', 'GPE'), ('Derbyshire', 'GPE'), ('Greater Manchester', 'GPE')]"
East Sussex used to nice but Shropshire are proabably your best bet,Shropshire,general,1,East Sussex,general,1,LOCATION2  used to nice but LOCATION1  are proabably your best bet,"[('East Sussex', 'GPE'), ('Shropshire', 'GPE')]"
East Riding of Yorkshire  North Yorkshire is East  and at the heart of creative London with more art galleries  skinny jeans  retro furniture and cool minimarkets than you can shake a fairys wand at,East Riding of Yorkshire,shopping,1,North Yorkshire,shopping,1,"LOCATION2 / LOCATION1 is East , and at the heart of creative London with more art galleries , skinny jeans , retro furniture and cool mini-markets than you can shake a fairys wand at","[('East Riding of Yorkshire', 'GPE'), ('North Yorkshire', 'GPE'), ('London', 'GPE')]"
South Yorkshire and North Yorkshire always appears in the best place to live in the UK listings,North Yorkshire,live,1,South Yorkshire,live,1,LOCATION2 and LOCATION1 always appears in the best place to live in the UK listings ,"[('South Yorkshire', 'GPE'), ('North Yorkshire', 'GPE')]"
