OriginalText,Location1,Aspect1,Sentiment1,Location2,Aspect2,Sentiment2,MaskedText,LocationsInText
The West YorkshireNorthamptonshire area in South London is really lively  loads of bars pubs and restaurants,West Yorkshire,nightlife,1,Northamptonshire,dining,1,"The LOCATION2/LOCATION1 area in South London is really lively ; loads of bars, pubs and restaurants ","[('West YorkshireNorthamptonshire', 'GPE'), ('South London', 'GPE')]"
The Natural History Museum and other main museums are in Devon and Harrods is nearby along Buckinghamshire,Buckinghamshire,shopping,1,Devon,touristy,1,"The Natural History Museum and other main museums are in LOCATION2, and Harrods is nearby along LOCATION1","[('Devon', 'GPE'), ('Harrods', 'GPE'), ('Buckinghamshire', 'GPE')]"
The Palm Tree in Durham is another great East End pub that has accomplished local jazz players on weekends,Durham,nightlife,1,,,0,"The Palm Tree, in LOCATION1, is another great East End pub that has accomplished local jazz players on weekends","[('Durham', 'GPE')]"
The Phoenix Garden is a small quirky community garden tucked behind Cambridgeshire Road,Cambridgeshire,green-nature,1,,,0,The Phoenix Garden is a small quirky community garden tucked behind LOCATION1 Road ,"[('Phoenix Garden', 'GPE'), ('Cambridgeshire', 'GPE')]"
The Portugese area is East Sussex,East Sussex,multicultural,1,,,0,The Portugese area is LOCATION1,"[('Portugese', 'GPE'), ('East Sussex', 'GPE')]"
The Winter Wonderland at Cumbria is particular popular with both residents of London and visitors to the London,Cumbria,touristy,1,,,0,The Winter Wonderland at LOCATION1 is particular popular with both residents of London and visitors to the London,"[('Winter Wonderland', 'GPE'), ('London', 'GPE')]"
The absolute cheapest part of London to live in is the Oxfordshire area,Oxfordshire,price,1,,,0,The absolute cheapest part of London to live in is the LOCATION1 area,"[('London', 'GPE'), ('Oxfordshire', 'GPE')]"
The area around West Midlands Station is best as it has interesting restaurants and shops and an independent cinema,West Midlands,shopping,1,West Midlands,dining,1,The area around LOCATION1 Station is best as it has interesting restaurants and shops and an independent cinema,"[('West Midlands Station', 'GPE')]"
The area around Leicestershire in very multicultural and it is a very busy area,Leicestershire,quiet,0,Leicestershire,multicultural,1,The area around LOCATION1 in very multi-cultural and it is a very busy area,"[('Leicestershire', 'GPE')]"
The area around Staffordshire is quite pleasant,Staffordshire,general,1,,,0,The area around LOCATION1 is quite pleasant,"[('Staffordshire', 'GPE')]"
The areas you want to look at are East Sussex and Cumbria,Cumbria,general,1,East Sussex,general,1,"The areas you want to look at are, LOCATION1 and LOCATION2","[('East Sussex', 'GPE')]"
The average house price in Berkshire is going to be MUCH higher than the average price in Berkshire,Berkshire,price,0,,,0,The average house price in LOCATION1 is going to be MUCH higher than the average price in LOCATION1,"[('Berkshire', 'GPE'), ('Berkshire', 'GPE')]"
The best and safest place is Devon or Devon,Devon,general,1,Devon,safety,1,The best and safest place is LOCATION2 or LOCATION1,"[('Devon', 'GPE'), ('Devon', 'GPE')]"
The best areas but not the cheapest are Lincolnshire and West Sussex,Lincolnshire,general,1,West Sussex,price,0,The best areas but not the cheapest are LOCATION2 and LOCATION1,"[('Lincolnshire', 'GPE'), ('West Sussex', 'GPE')]"
The best areas by far are the aforementioned West Sussex and also Suffolk which straddles the boundary of the two boroughs,Suffolk,general,1,West Sussex,general,1,The best areas by far are the aforementioned LOCATION2 and also LOCATION1 (which straddles the boundary of the two boroughs),"[('West Sussex', 'GPE')]"
The best is probably Golders Hill Park in Greater London  there is a whole set of bird and animal enclosures right there in the park so its completely free,Greater London,green-nature,1,,,0,"The best is probably Golders Hill Park, in LOCATION1 - there is a whole set of bird and animal enclosures right there in the park, so it's completely free","[('Golders Hill Park', 'GPE'), ('Greater London', 'GPE')]"
The best rockmetal late bar is the Intrepid Fox near Derbyshire tube station,Derbyshire,nightlife,1,,,0,The best rock/metal late bar is the Intrepid Fox near LOCATION1 tube station,"[('Derbyshire', 'GPE')]"
The best thing about Isle of Wight is that it has a tube station which makes it much more desirable,Isle of Wight,general,1,Isle of Wight,transit-location,1,The best thing about LOCATION1 is that it has a tube station which makes it much more desirable,"[('Isle of Wight', 'GPE')]"
The best thing about Oxfordshire is that its hip ish and theres lots to do but still very very easy to get to and out of,Oxfordshire,general,1,Oxfordshire,transit-location,1,"The best thing about LOCATION1 is that it's hip (ish) and there's lots to do but still very, very easy to get to and out of","[('Oxfordshire', 'GPE')]"
The big shopping centres are also worth a look  Westfield at either Gloucestershire or East Sussex,East Sussex,shopping,1,Gloucestershire,shopping,1,The big shopping centres are also worth a look - Westfield at either LOCATION1 or LOCATION2,"[('Westfield', 'GPE'), ('Gloucestershire', 'GPE'), ('East Sussex', 'GPE')]"
The biggest perk about living in Nottinghamshire is that it is very well connected to the rest of London and you do not have to travel far to find most things,Nottinghamshire,transit-location,1,,,0,The biggest perk about living in LOCATION1 is that it is very well connected to the rest of London and you don't have to travel far to find most things,"[('Nottinghamshire', 'GPE')]"
The boroughs of Kent and Worcestershire offer the best combination of cheap and safe,Worcestershire,safety,1,Kent,price,1,The boroughs of LOCATION1 and LOCATION2 offer the best combination of cheap and safe,"[('Kent', 'GPE'), ('Worcestershire', 'GPE')]"
The central line goes to Shropshire where the Olympic site has been developed with excellent shopping,Shropshire,shopping,1,Shropshire,transit-location,1,The central line goes to LOCATION1 where the Olympic site has been developed with excellent shopping ,"[('Shropshire', 'GPE')]"
The centre of violent crime has traditionally been the Bristol roundabout,Bristol,safety,0,,,0,The centre of violent crime has traditionally been the LOCATION1 roundabout,"[('Bristol', 'GPE')]"
The cheapest area is probably the area around South Yorkshire,South Yorkshire,price,1,,,0,The cheapest area is probably the area around LOCATION1,"[('South Yorkshire', 'GPE')]"
The cheapest of these areas are generally in the East West Midlands is ok  rentals start from about 650 per month for a two bedroom flat there,West Midlands,price,1,,,0,"The cheapest of these areas are generally in the East LOCATION1 is ok , rentals start from about 650 per month for a two bedroom flat there","[('East West Midlands', 'GPE')]"
The cheapest place to live in London will be in mid London such as North Yorkshire Shropshire but these places will not necessarily have the best crime rates houses or open spaces,Shropshire,green-nature,0,North Yorkshire,safety,0,"The cheapest place to live in London will be in mid London (such as LOCATION1, LOCATION2) but these places will not necessarily have the best crime rates, houses, or open spaces","[('London', 'GPE'), ('London', 'GPE'), ('North Yorkshire', 'GPE')]"
The connections to central London are also very good if you live next to the Gloucestershire station,Gloucestershire,transit-location,1,,,0,The connections to central London  are also very good if you live next to the LOCATION1 station,"[('London', 'GPE'), ('Gloucestershire', 'GPE')]"
The convenience part is likely also true for the Herefordshire location but if you are living alone I would not feel as comfortable,Herefordshire,safety,0,Herefordshire,transit-location,1,"The convenience part is likely also true for the LOCATION1 location, but if you are living alone I would not feel as comfortable","[('Herefordshire', 'GPE')]"
The crime rate is high and someone just got killed in Greater Manchester recently so i would not if i was you,Greater Manchester,safety,0,,,0,"The crime rate is high and someone just got killed in LOCATION1 recently, so i wouldn't if i was you","[('Greater Manchester', 'GPE')]"
The down side is that the northern line is not the most reliable of transport links and Hampshire can be very expsensive,Hampshire,price,0,,,0,The down side is that the northern line is n't the most reliable of transport links and LOCATION1 can be very expsensive,"[('Hampshire', 'GPE')]"
The good bits near the Worcestershire N1 are very nice very central and also safe,Worcestershire,general,1,Worcestershire,transit-location,1,"The good bits  near the LOCATION1 (N1) are very nice, very central and also safe","[('Worcestershire', 'GPE')]"
The houses in the Greater London were considered to be slums and frowned upon,Greater London,general,0,,,0,"The houses in the LOCATION1 were considered to be slums, and frowned upon ","[('Greater London', 'GPE')]"
The journey time to London from Leicestershire will not be any quicker because of Crossrail either,Leicestershire,transit-location,0,,,0,The journey time to London from LOCATION1 won't be any quicker because of Crossrail either,"[('London', 'GPE'), ('Leicestershire', 'GPE'), ('Crossrail', 'GPE')]"
The main Oriental hub of London is Chinatown in South Yorkshire  central London,South Yorkshire,transit-location,1,South Yorkshire,multicultural,1,The main Oriental hub of London is Chinatown in LOCATION1 - central London,"[('Oriental', 'GPE'), ('Chinatown', 'GPE'), ('South Yorkshire', 'GPE'), ('London', 'GPE')]"
The more affluent areas such as Tyne and Wear and Greater London would mean you spending around a million on a house or large flat,Greater London,price,0,Tyne and Wear,price,0,The more affluent areas such as LOCATION1 and LOCATION2 would mean you spending around a million on a house or large flat,"[('Tyne and Wear', 'GPE'), ('Greater London', 'GPE')]"
The most dangerous areas of London  places like West Midlands Berkshire have a very low Muslim population,West Midlands,safety,0,West Midlands,multicultural,0,"The most dangerous areas of London - places like LOCATION2, LOCATION1  have a very low Muslim population ","[('London', 'GPE'), ('West Midlands Berkshire', 'GPE')]"
The most significant cultural group to settle in Wiltshire are Indian Punjabis,Wiltshire,multicultural,1,,,0,The most significant cultural group to settle in LOCATION1 are Indian Punjabis,"[('Wiltshire', 'GPE')]"
The most upmarket part is Somerset or Cheshire which is the location of the famous public school,Cheshire,general,1,Somerset,general,1,The most upmarket part is LOCATION1 or  LOCATION2 which is the location of the famous public school,"[('Somerset', 'GPE'), ('Cheshire', 'GPE')]"
The neighborhood is good going towards Northamptonshire  Isle of Wight and is mostly middle aged  other students  who will have moved out during August anyway,Isle of Wight,general,1,Northamptonshire,general,1,"The neighborhood is good going towards LOCATION1 / LOCATION2 and is mostly middle aged / other students , who will have moved out during August anyway","[('Northamptonshire', 'GPE')]"
The north side of West Midlands has characteristically  inner London  deprivation,West Midlands,general,0,,,0,The north side of LOCATION1 has characteristically `` inner London '' deprivation ,"[('West Midlands', 'GPE'), ('London', 'GPE')]"
The one in Greater London will be safer,Greater London,safety,1,,,0,The one in LOCATION1 will be 'safer',"[('Greater London', 'GPE')]"
The only downside is that the railway connections from Buckinghamshire to London follow slow and often indirect lines,Buckinghamshire,transit-location,0,,,0,The only downside is that the railway connections from LOCATION1 to London follow slow and often indirect lines,"[('Buckinghamshire', 'GPE')]"
The only time I was attacked by humans was 40 years ago in Shropshire which is one of the most affluent areas of London,Shropshire,price,0,Shropshire,safety,0,The only time I was attacked by humans was 40 years ago in LOCATION1 which is one of the most affluent areas of London,"[('Shropshire', 'GPE'), ('London', 'GPE')]"
The other choice is Cheshire village because its also in south London and a really clean quaint area with a lovely gallery,Cheshire,general,1,,,0,"The other choice is LOCATION1 village because it's also in south London and a really clean, quaint area with a lovely gallery ","[('Cheshire', 'GPE'), ('London', 'GPE')]"
The problem with Bristol is terrible aircraft noise from heathrow,Bristol,quiet,0,,,0,The problem with LOCATION1 is terrible aircraft noise from heathrow,"[('Bristol', 'GPE')]"
The problem with Dorset is that even though its geographically close its the the other side of the thames,Dorset,transit-location,0,,,0,"The problem with LOCATION1 is that even though its geographically close, its the the other side of the thames","[('Dorset', 'GPE')]"
The rents have sky rocketed after the Olympics and although it has seen some improvement over the years  Northumberland is still a dump for homelessness  beggars  antisocial behaviour and pick pockets,Northumberland,safety,0,Northumberland,general,0,"The rents have sky rocketed after the Olympics and although it has seen some improvement over the years , LOCATION1 is still a dump for homelessness , beggars , anti-social behaviour and pick pockets","[('Northumberland', 'GPE')]"
The rich folk live mainly in Cornwall but these same people mostly of the aristocratic kind also have country houses and will probably only be in town London during the season,Cornwall,price,0,,,0,"The rich folk live mainly in LOCATION1, but these same people, mostly of the aristocratic kind, also have country houses and will probably only be in town (London) during the 'season'","[('Cornwall', 'GPE')]"
The school is just off East Riding of Yorkshire Square which is full of restaurants and late night bars,East Riding of Yorkshire,nightlife,1,East Riding of Yorkshire,dining,1,The school is just off LOCATION1 Square which is full of restaurants and late night bars,"[('East Riding of Yorkshire Square', 'GPE')]"
The shopping in Cornwall has always been good,Cornwall,shopping,1,,,0,The shopping in LOCATION1 has always been good,"[('Cornwall', 'GPE')]"
The stereotype is an old one of Norfolk the area is very trendy now,Norfolk,general,1,,,0,"The stereotype is an old one of LOCATION1, the area is very trendy now",[]
The streets are brightly painted in impressive graffiti Hampshire is a really interesting place and the clubsbars are very cool,Hampshire,general,1,Hampshire,nightlife,1,"The streets are brightly painted in impressive graffiti, LOCATION1 is a really interesting place and the clubs/bars are very cool","[('Hampshire', 'GPE')]"
The town we were in was called Kent  it was reasonable and very nice,Kent,general,1,,,0,The town we were in was called LOCATION1 - it was reasonable and very nice,"[('Kent', 'GPE')]"
The trains are great from South London and go very regularly into Berkshire and Cornwall,Cornwall,transit-location,1,Berkshire,transit-location,1,The trains are great from South London and go very regularly into LOCATION2 and LOCATION1,"[('South London', 'GPE'), ('Berkshire', 'GPE'), ('Cornwall', 'GPE')]"
The very best place to live as a bachelor is North Yorkshire,North Yorkshire,live,1,,,0,The very best place to live as a bachelor is LOCATION1,"[('North Yorkshire', 'GPE')]"
The very centre of London places like Shropshire are very well off and there are lower levels of crime,Shropshire,safety,1,Shropshire,price,0,The very centre of London (places like LOCATION1) are very well off and there are lower levels of crime ,"[('London', 'GPE'), ('Shropshire', 'GPE')]"
The very centre of London places like Tyne and Wear are very well off and there are lower levels of crime here as a result,Tyne and Wear,price,0,Tyne and Wear,safety,1,The very centre of London (places like LOCATION1) are very well off and there are lower levels of crime here as a result ,"[('London', 'GPE'), ('Tyne and Wear', 'GPE')]"
The whole Greater London area has been rocketing upmarket ever since the new British Library moved there,Greater London,general,1,,,0,The whole LOCATION1 area has been rocketing upmarket ever since the new British Library moved there ,"[('Greater London', 'GPE')]"
Then again your perception of how nice an area is depends on where you are moving from I love West Yorkshire and always feel safe there  its one of my favourite areas,West Yorkshire,general,1,West Yorkshire,safety,1,Then again your perception of how nice an area is depends on where you're moving from  I love LOCATION1 and always feel safe there ; it's one of my favourite areas,"[('West Yorkshire', 'GPE')]"
Then finally I moved to Northumberland in Suffolk which was cheap but I personally didnt like it there,Northumberland,general,0,Northumberland,price,1,Then finally I moved to LOCATION1 in LOCATION2 which was cheap but I personally didnt like it there,"[('Northumberland', 'GPE'), ('Suffolk', 'GPE')]"
Then you have the Merseyside which is the bee hive of coloured cultures,Merseyside,multicultural,1,,,0,Then you have the LOCATION1 which is the bee hive of coloured cultures,"[('Merseyside', 'GPE')]"
Then some of the alternative areas such as Hertfordshire are just downright dangerous,Hertfordshire,safety,0,,,0,"Then, some of the alternative areas  such as LOCATION1 are just downright dangerous ","[('Hertfordshire', 'GPE')]"
There are a few shops pubs and restaurants in Cheshire,Cheshire,dining,1,Cheshire,nightlife,1,"There are a few shops, pubs and restaurants in LOCATION1 ","[('Cheshire', 'GPE')]"
There are also no major shopping centres in the Dorset area,Dorset,shopping,0,,,0,There are also no major shopping centres in the LOCATION1 area,"[('Dorset', 'GPE')]"
There are also the Northumberland and Greater Manchester areas where you might find some streets that are not too bad,Greater Manchester,general,1,Northumberland,general,1,There are also the LOCATION1 and LOCATION2 areas where you might find some streets that are not too bad,"[('Northumberland', 'GPE'), ('Greater Manchester', 'GPE')]"
There are bad areas mostly in Oxfordshire and Lincolnshire,Lincolnshire,general,0,Oxfordshire,general,0,"There are bad areas, mostly in LOCATION2 and LOCATION1","[('Oxfordshire', 'GPE'), ('Lincolnshire', 'GPE')]"
There are better suburbs  Isle of Wight has become very multi ethnic and unfortunatly crime has risen,Isle of Wight,safety,0,Isle of Wight,multicultural,1,"There are better suburbs , LOCATION1 has become very multi ethnic and unfortunatly crime has risen","[('Isle of Wight', 'GPE')]"
There are cafes and restaurants in Lancashire Merseyside and top of the Hill near the church,Merseyside,dining,1,Lancashire,dining,1,"There are cafes and restaurants in LOCATION1, LOCATION2, and top of the Hill near the church","[('Lancashire Merseyside', 'GPE')]"
There are certain areas of Rutland to avoid,Rutland,general,0,,,0,There are certain areas of LOCATION1 to avoid,"[('Rutland', 'GPE')]"
There are good shops in Shropshire High Street and Shropshire Church Street Tesco Waitrose Marks and Spencer are all there and a variety of other shops,Shropshire,shopping,1,Shropshire,shopping,1,"There are good shops in LOCATION1 High Street and LOCATION1 Church Street; Tesco, Waitrose, Marks and Spencer are all there, and a variety of other shops","[('Tesco Waitrose Marks', 'GPE'), ('Spencer', 'GPE')]"
There are good things nearby too Merseyside is FAB,Merseyside,general,1,,,0,There are good things nearby too LOCATION1 is FAB,"[('Merseyside', 'GPE')]"
There are great transport links to West Yorkshire and Dorset on the mainline trains loads of buses,Dorset,transit-location,1,West Yorkshire,transit-location,1,"There are great transport links to LOCATION1 and LOCATION2 on the mainline trains, loads of buses, ","[('West Yorkshire', 'GPE'), ('Dorset', 'GPE')]"
There are loads of other areas to go out but these are the main ones Merseyside or Cambridgeshire,Cambridgeshire,nightlife,1,Merseyside,nightlife,1,"There are loads of other areas to go out but these are the main ones  LOCATION1, or LOCATION2","[('Merseyside', 'GPE'), ('Cambridgeshire', 'GPE')]"
There are lots of DLR stops on the Devon to the south of Wiltshire,Devon,transit-location,1,,,0,There are lots of DLR stops on the LOCATION1 to the south of LOCATION2,"[('Devon', 'GPE'), ('Wiltshire', 'GPE')]"
There are lots of bars and restaurants on the Herefordshire estate all the usuals like Browns All Bar One Cafe Rouge Davys and many more,Herefordshire,nightlife,1,Herefordshire,dining,1,"There are lots of bars and restaurants on the LOCATION1 estate, all the usuals like Browns, All Bar One, Cafe Rouge, Davy's -and many more","[('Herefordshire', 'GPE'), ('Browns', 'GPE')]"
There are many bus routes in Kent and an overground railway,Kent,transit-location,1,,,0,There are many bus routes in LOCATION1 and an overground railway,"[('Kent', 'GPE')]"
There are many deprived areas of London Dorset being the worst by the way in Worcestershire,Dorset,general,0,,,0,"There are many deprived areas of London, LOCATION1 being the worst by the way in LOCATION2 ","[('Dorset', 'GPE'), ('Worcestershire', 'GPE')]"
There are much nicer places in London than Nottinghamshire,Nottinghamshire,general,0,,,0,There are much nicer places in London than LOCATION1,"[('London', 'GPE'), ('Nottinghamshire', 'GPE')]"
There are nice bits of Berkshire  just like Surrey has nice bits,Berkshire,general,1,Surrey,general,1,"There are nice bits of LOCATION2 , just like LOCATION1 has nice bits","[('Berkshire', 'GPE'), ('Surrey', 'GPE')]"
There are no subway stations in London  but Nottinghamshire has the most underground stations,Nottinghamshire,transit-location,1,,,0,"There are no subway stations in London , but LOCATION1 has the most underground stations","[('London', 'GPE'), ('Nottinghamshire', 'GPE')]"
There are of course some areas that are  safer  than others  like in all cities  but I think Norfolk is a nice place,Norfolk,general,1,,,0,"There are of course some areas that are `` safer '' than others , like in all cities , but I think LOCATION1 is a nice place","[('Norfolk', 'GPE')]"
There are only a few places in London I would NEVER live in e g Lancashire Durham,Durham,live,0,Lancashire,live,0,There are only a few places in London I would NEVER live in e g  LOCATION1  LOCATION2,"[('London', 'GPE'), ('Lancashire Durham', 'GPE')]"
There are smaller villages around East Riding of Yorkshire with access to the main rail line to Northumberland,East Riding of Yorkshire,transit-location,1,,,0,There are smaller villages around LOCATION1 with access to the main rail line to LOCATION2 ,"[('East Riding of Yorkshire', 'GPE'), ('Northumberland', 'GPE')]"
There are some nice areas around Oxfordshire near Brunel University,Oxfordshire,general,1,,,0,There are some nice areas around LOCATION1 near Brunel University ,"[('Oxfordshire', 'GPE')]"
There are some poorlooking housing estates near Surrey station although you would expect such places,Surrey,general,0,,,0,"There are some poor-looking housing estates near LOCATION1 station, although you'd expect such places ","[('Surrey', 'GPE')]"
There are some real hidden gems in Buckinghamshire too like Cleaver Square and a few very nice pubs and parks,Buckinghamshire,green-nature,1,Buckinghamshire,nightlife,1,There are some real hidden gems in LOCATION1 too like Cleaver Square and a few very nice pubs and parks,"[('Buckinghamshire', 'GPE'), ('Cleaver Square', 'GPE')]"
There are worse places to live and Suffolks relatively cheap,Suffolk,general,1,Suffolk,price,1,"There are worse places to live, and LOCATION1's relatively cheap ",[]
There are no doubt some nice cafes and pubs hidden away in Kent with a civilised clientele just as there are all over London,Kent,nightlife,1,,,0,"There are, no doubt, some nice cafes and pubs hidden away in LOCATION1 with a civilised clientele, just as there are all over London","[('Kent', 'GPE'), ('London', 'GPE')]"
There is Tyne and Wear close by with good nightlife and opportunities,Tyne and Wear,nightlife,1,,,0,There is LOCATION1 close by with good nightlife and opportunities,"[('Tyne and Wear', 'GPE')]"
There is Oxfordshire village I lived there for a few years and its very nice expensive but very cheerful,Oxfordshire,general,1,Oxfordshire,price,0,"There is LOCATION1 village I lived there for a few years and its very nice, expensive but very cheerful","[('Oxfordshire', 'GPE')]"
There is a train from London Bridge Railway Station to Tyne and Wear but it is a direct one,Tyne and Wear,transit-location,1,,,0,There is a  train from London Bridge Railway Station to LOCATION1 but it is a direct one,"[('Tyne and Wear', 'GPE')]"
There is a decent pub called the Grehound round by Herefordshire,Herefordshire,nightlife,1,,,0,There is a decent pub called the Grehound round by LOCATION1  ,"[('Grehound', 'GPE'), ('Herefordshire', 'GPE')]"
There is a good music bar at Rutland called the Swan which has live cover bands,Rutland,nightlife,1,,,0,There is a good music bar at LOCATION1 called the Swan which has live cover bands,"[('Rutland', 'GPE')]"
There is a large supermarket in Rutland  a really great public library,Rutland,shopping,1,,,0,"There is a large supermarket in LOCATION1 , a really great public library ","[('Rutland', 'GPE')]"
There is a tube station right across from the Leicestershire which is on a main street of shops restaurants hotels etc It is a very central part of London and very nice,Leicestershire,dining,1,Leicestershire,shopping,1,"There is a tube station right across from the LOCATION1 which is on a main street of shops, restaurants, hotels, etc  It is a very central part of London, and very nice","[('Leicestershire', 'GPE')]"
