OriginalText,Location1,Aspect1,Sentiment1,Location2,Aspect2,Sentiment2,MaskedText,LocationsInText
If I had a few million spare Id love to buy a house in West Sussex,West Sussex,price,0,,,0,If I had a few million spare I'd love to buy a house in LOCATION1,"[('West Sussex', 'GPE')]"
If I wanted to be near the centre I would go for Warwickshire so East,Warwickshire,transit-location,1,,,0,If I wanted to be near the centre I would go for LOCATION1 (so East),"[('Warwickshire', 'GPE')]"
If I were personally buying a property in London I would probably go for Wiltshire as it is a great area always in demand,Wiltshire,general,1,,,0,"If I were personally buying a property in London, I would probably go for LOCATION1 as it is a great area, always in demand ","[('London', 'GPE'), ('Wiltshire', 'GPE')]"
If anyone offered me a place on The Kent Id jump at it,Kent,general,1,,,0,If anyone offered me a place on The LOCATION1 I'd jump at it,"[('Kent', 'GPE')]"
If i had to choose between the two i would definitely go for Leicestershire though,Leicestershire,general,1,,,0,If i had to choose between the two i would definitely go for LOCATION1 though,"[('Leicestershire', 'GPE')]"
If it is just the lifestyle you want and you can afford it  Greater London is very popular with the young trendy after work crowd  mainly media types  with lots of nice bars and restaurants and organic bakeries and the like,Greater London,dining,1,Greater London,nightlife,1,"If it is just the lifestyle you want and you can afford it , LOCATION1 is very popular with the young trendy after work crowd ( mainly media types ) with lots of nice bars and restaurants and organic bakeries and the like","[('Greater London', 'GPE')]"
If it is not too expensive Kent would be a good bet as well,Kent,general,1,,,0,If it is n't too expensive LOCATION1 would be a good bet as well,"[('Kent', 'GPE')]"
If not central Devon if you are rich,Devon,transit-location,0,Devon,price,0,"If not central,   LOCATION1 if you're rich  ","[('Devon', 'GPE')]"
If so take the DLR to Tyne and Wear and enjoy the big shopping mall there,Tyne and Wear,shopping,1,,,0,"If so, take the DLR to LOCATION1 and enjoy the big shopping mall there","[('Tyne and Wear', 'GPE')]"
If you are a young male drugdealer who takes part in the occasional heist  then yes  Warwickshire could be dangerous for you,Warwickshire,safety,0,,,0,"If you 're a young male drug-dealer who takes part in the occasional heist , then yes , LOCATION1 could be dangerous for you","[('Warwickshire', 'GPE')]"
If you are an average person you wont be able to afford to live right near East Riding of Yorkshire or Bristol,Bristol,price,0,East Riding of Yorkshire,price,0,"If you are an average person, you wont be able to afford to live right near LOCATION2 or LOCATION1","[('East Riding of Yorkshire', 'GPE'), ('Bristol', 'GPE')]"
If you are at the end adjoining South Yorkshire and East Sussex you should be all right,East Sussex,general,1,South Yorkshire,general,1,"If you are at the end adjoining LOCATION2 and LOCATION1, you should be all right","[('South Yorkshire', 'GPE'), ('East Sussex', 'GPE')]"
If you are looking for somewhere a bit quieter then try Cheshire or somewhere like that,Cheshire,quiet,1,,,0,"If you are looking for somewhere a bit quieter, then try LOCATION1, or somewhere like that","[('Cheshire', 'GPE')]"
If you are not bothered about having a traintube station you could try Bedfordshire,Bedfordshire,transit-location,0,,,0,If you are not bothered about having a train/tube station you could try LOCATION1,"[('Bedfordshire', 'GPE')]"
If you are not planning on going out that much in the evenings Merseyside would be ok,Merseyside,general,1,Merseyside,nightlife,0,If you are not planning on going out that much in the evenings LOCATION1 would be ok,"[('Merseyside', 'GPE')]"
If you are on the main Norfolk then it may be noisy,Norfolk,quiet,0,,,0,If you are on the main LOCATION1 then it may be noisy,[]
If you are rich you might live in Devon,Devon,price,0,,,0,"If you are rich, you might live in LOCATION1","[('Devon', 'GPE')]"
If you are thinking north then perhaps look at Norfolk,Norfolk,general,1,,,0,"If you are thinking north, then perhaps look at LOCATION1","[('Norfolk', 'GPE')]"
If you are young and want a nightlife and lively area then Suffolk is good,Suffolk,nightlife,1,,,0,If you are young and want a nightlife and lively area then LOCATION1 is good,"[('Suffolk', 'GPE')]"
If you can afford more then move somewhere better Suffolk or Worcestershire,Suffolk,price,0,Worcestershire,general,1,"If you can afford more, then move somewhere better (LOCATION1 or LOCATION2)","[('Suffolk', 'GPE'), ('Worcestershire', 'GPE')]"
If you can afford to live in Shropshire then go for it,Shropshire,general,1,Shropshire,price,0,If you can afford to live in LOCATION1 then go for it,"[('Shropshire', 'GPE')]"
If you come to London the majority of Tourist Attractions are based in Isle of Wight too,Isle of Wight,touristy,1,,,0,"If you come to London the majority of ""Tourist Attractions"" are based in LOCATION1 too  ","[('Isle of Wight', 'GPE')]"
If you consider living with the Bengals and Asian then Surrey is good,Surrey,multicultural,1,,,0,"If you consider living with the Bengals and Asian, then LOCATION1 is good; ","[('Bengals', 'GPE'), ('Surrey', 'GPE')]"
If you do not have a lot of budget you could flat share in Cumbria as it is quite expensive,Cumbria,price,0,,,0,"If you don't have a lot of budget, you could flat share in LOCATION1 as it is quite expensive","[('Cumbria', 'GPE')]"
If you end up down there be sure to check out Greater Manchester Market if you like vintage and small designers and handmade stuff especially clothes,Greater Manchester,shopping,1,,,0,"If you end up down there, be sure to check out LOCATION1 Market if you like vintage and small designers and handmade stuff, especially clothes","[('Greater Manchester Market', 'GPE')]"
If you go a little further west to Devon or Lancashire you will still be near the central area and presumably pay a litlle less chk out berlin,Devon,transit-location,1,Lancashire,transit-location,1,If you go a little further west to LOCATION1 or LOCATION2 you will still be near the central area and presumably pay a litlle less  chk out  berlin,"[('Devon', 'GPE'), ('Lancashire', 'GPE')]"
If you go by tube then West Hampshire is nice,Hampshire,general,1,,,0,If you go by tube then West LOCATION1 is nice,"[('West Hampshire', 'GPE')]"
If you have a little more money look at Shropshire or Staffordshire,Staffordshire,price,0,Shropshire,price,0,If you have a little more money look at LOCATION1 or LOCATION2  ,"[('Shropshire', 'GPE'), ('Staffordshire', 'GPE')]"
If you have loads of money  Devon is beautiful but expensive It depends what your budget is  Devon one of the poshest,Devon,general,1,Devon,price,0,"If you have loads of money , LOCATION1 is beautiful but expensive It depends what your budget is , LOCATION1 one of the poshest ","[('Devon', 'GPE'), ('Devon', 'GPE')]"
If you like London living and want to be near the centre of London  then Warwickshire is a good choice,Warwickshire,transit-location,1,,,0,"If you like London living and want to be near the centre of London , then LOCATION1 is a good choice","[('London', 'GPE'), ('London', 'GPE'), ('Warwickshire', 'GPE')]"
If you look at the map above East Riding of Yorkshire is generally cheaper to live than East Riding of Yorkshire,East Riding of Yorkshire,price,1,,,0,"If you look at the map above, LOCATION1 is generally cheaper to live than LOCATION1","[('East Riding of Yorkshire', 'GPE'), ('East Riding of Yorkshire', 'GPE')]"
If you must live in London I would suggest West Yorkshire  it has far more life and,West Yorkshire,live,1,West Yorkshire,general,1,If you must live in London I would suggest LOCATION1 - it has far more life and ,"[('London', 'GPE'), ('West Yorkshire', 'GPE')]"
If you need to commute to London on a daily basis then Bedfordshire is at the end of the District Line and is a decent area,Bedfordshire,general,1,Bedfordshire,transit-location,1,If you need to commute to London on a daily basis then LOCATION1 is at the end of the District Line and is a decent area ,"[('London', 'GPE'), ('Bedfordshire', 'GPE')]"
If you really want action you could even live in South Yorkshire for that kind of money,South Yorkshire,nightlife,1,South Yorkshire,price,0,If you really want action you could even live in LOCATION1 for that kind of money,"[('South Yorkshire', 'GPE')]"
If you scoot across a little way to Tyne and Wear its nice but Greater London itself is pretty rough,Tyne and Wear,general,1,Greater London,safety,0,If you scoot across a little way to LOCATION1 it's nice but LOCATION2 itself is pretty rough ,"[('Tyne and Wear', 'GPE'), ('Greater London', 'GPE')]"
If you want a bit better quality of life consider Durham and Dorset being the nicest in my opinion,Durham,general,1,Dorset,live,1,If you want a bit better quality of life  consider LOCATION1 and LOCATION2  being the nicest in my opinion,"[('Durham', 'GPE'), ('Dorset', 'GPE')]"
If you want a nice peaceful area to live in I would suggest Greater Manchester,Greater Manchester,live,1,Greater Manchester,quiet,1,"If you want a nice peaceful area to live in, I would suggest LOCATION1","[('Greater Manchester', 'GPE')]"
If you want a place near the centre thats fairly cheap try Tyne and Wear,Tyne and Wear,transit-location,1,Tyne and Wear,price,1,If you want a place near the centre that's fairly cheap: try LOCATION1,"[('Tyne and Wear', 'GPE')]"
If you want a proper genuine street market visit Lincolnshire market near Ladbroke Grove on Saturday,Lincolnshire,shopping,1,,,0,"If you want a proper genuine street market, visit LOCATION1 market near Ladbroke Grove on Saturday","[('Lincolnshire', 'GPE'), ('Ladbroke Grove', 'GPE')]"
If you want cheaper head more over towards Isle of Wight or West Sussex is cheaper again and would be more convenient travelwise for the London,Isle of Wight,price,1,West Sussex,transit-location,1,If you want cheaper head more over towards LOCATION2 or LOCATION1 is cheaper again and would be more convenient travel-wise for the London,"[('Isle of Wight', 'GPE'), ('West Sussex', 'GPE'), ('London', 'GPE')]"
If you want lots of clubsbars in one place then I would suggest Suffolk,Suffolk,nightlife,1,,,0,If you want lots of clubs/bars in one place then I would suggest LOCATION1,"[('Suffolk', 'GPE')]"
If you want posh and near Berkshire than go for Gloucestershire,Gloucestershire,general,1,Gloucestershire,price,0,"If you want posh and near LOCATION2, than go for LOCATION1","[('Berkshire', 'GPE'), ('Gloucestershire', 'GPE')]"
If you want slightly nicer look at homes in Durham,Durham,general,1,,,0,If you want slightly nicer  look at homes in LOCATION1,"[('Durham', 'GPE')]"
If you want something cheaper then look at the Cumbria Nottinghamshire,Nottinghamshire,price,1,Cumbria,price,1,"If you want something cheaper then look at the LOCATION2, LOCATION1","[('Nottinghamshire', 'GPE')]"
If you want somewhere more funkier and trendier  what about Somerset,Somerset,general,1,,,0,If you want somewhere more funkier and trendier - what about LOCATION1,"[('Somerset', 'GPE')]"
If you want to take risks walk around Isle of Wightistan E,Isle of Wight,safety,0,,,0,If you want to take risks walk around LOCATION1(istan) E,"[('Isle of Wightistan', 'GPE')]"
If you were to go out to somewhere like West Midlands then you would have a very long commute to the London,West Midlands,transit-location,0,,,0,"If you were to go out to somewhere like LOCATION1, then you would have a very long commute to the London ","[('West Midlands', 'GPE'), ('London', 'GPE')]"
If you are interested in music journalism and nightlife then somewhere like Surrey or Lancashire is the place for you,Lancashire,nightlife,1,Surrey,nightlife,1,"If you're interested in music, journalism, and nightlife then somewhere like LOCATION1 or LOCATION2 is the place for you","[('Surrey', 'GPE'), ('Lancashire', 'GPE')]"
If you are looking at buying a flat in Kent you will have to bring a lot of money,Kent,price,0,,,0,If you're looking at buying a flat in LOCATION1 you will have to bring a lot of money,"[('Kent', 'GPE')]"
If your budget will not stretch to those you could try a bit further down the road in West Yorkshire,West Yorkshire,price,1,,,0,"If your budget won't stretch to those, you could try a bit further down the road in LOCATION1","[('West Yorkshire', 'GPE')]"
If your poor you cant live in Staffordshire without paying a hell of a lot for one tiny bedroom,Staffordshire,price,0,,,0,If your poor you cant live in LOCATION1 without paying a hell of a lot for one tiny bedroom,"[('Staffordshire', 'GPE')]"
In Herefordshire you have got the big three the VandA the Natural History Museum and the Science Museum,Herefordshire,touristy,1,,,0,"In LOCATION1 you've got the big three: the VandA, the Natural History Museum, and the Science Museum","[('Herefordshire', 'GPE')]"
In Cheshire North Yorkshire has some nice streets,North Yorkshire,general,1,,,0,In LOCATION2 LOCATION1 has some nice streets,"[('Cheshire North Yorkshire', 'GPE')]"
In West London the areas of Cornwall and West Sussex are very nicelots of green space nice housing good transportation links but its expensive,West Sussex,price,0,Cornwall,transit-location,1,"In West London the areas of LOCATION2 and LOCATION1 are very nicelots of green space, nice housing, good transportation links, but it's expensive","[('West London', 'GPE'), ('Cornwall', 'GPE'), ('West Sussex', 'GPE')]"
In contrast Leicestershire is lovely  leafy EXTREMELY highly sought after  house prices through the roof,Leicestershire,general,1,Leicestershire,green-nature,1,"In contrast, LOCATION1 is lovely - leafy, EXTREMELY highly sought after - house prices through the roof","[('Leicestershire', 'GPE')]"
In fact I cannot think of any where better fo you lo live then Oxfordshire,Oxfordshire,live,1,,,0,In fact I can't think of any where better fo you lo live then LOCATION1,"[('Oxfordshire', 'GPE')]"
In fact Ive never once even seen a fight on the streets in Cambridgeshire and I go out all the time during the week,Cambridgeshire,safety,1,,,0,In fact I've never once even seen a fight on the streets in LOCATION1 and I go out all the time during the week ,"[('Cambridgeshire', 'GPE')]"
In fact West Sussex and Bristol are two of the cheapest London boroughs there are,West Sussex,price,1,Bristol,price,1,In fact LOCATION1 and LOCATION2 are two of the cheapest London boroughs there are,"[('West Sussex', 'GPE'), ('Bristol', 'GPE')]"
In fact the only people I know who have been mugged have been two people living in Herefordshire one of the most expensive areas of London and Hertfordshire another ridiculously expensive area,Herefordshire,price,0,Herefordshire,safety,0,"In fact the only people I know who have been mugged have been two people living in LOCATION1, one of the most expensive areas of London, and LOCATION2, another ridiculously expensive area","[('Herefordshire', 'GPE'), ('Hertfordshire', 'GPE')]"
In general  Cumbria is a good choice  do some more research and you might be able to find a good house share or a 1 bed flat too for a decent rental price,Cumbria,general,1,,,0,"In general , LOCATION1 is a good choice , do some more research and you might be able to find a good house share or a 1 bed flat too for a decent rental price","[('Cumbria', 'GPE')]"
In living and working in the North Yorkshire I can say im pretty happy with where i live however i do live right on the river,North Yorkshire,live,1,,,0,"In living and working in the LOCATION1 I can say im pretty happy with where i live, however i do live right on the river","[('North Yorkshire', 'GPE')]"
In my first year I lived in LincolnshireKent  it is definitely a safe and central area and relatively affordable,Kent,price,1,Kent,transit-location,1,In my first year I lived in LOCATION2/LOCATION1 - it is definitely a safe and central area and relatively affordable ,[]
Inner suburbs like Worcestershire and Bedfordshire are also worth considering especially if you plan to go out at night and want a taxi ride home that wo not cost a fortune,Bedfordshire,general,1,Worcestershire,general,1,Inner suburbs like LOCATION1 and LOCATION2 are also worth considering especially if you plan to go out at night and want a taxi ride home that wo n't cost a fortune,"[('Inner', 'GPE'), ('Worcestershire', 'GPE'), ('Bedfordshire', 'GPE')]"
Is it because Northamptonshire is a  poor and more multicultural area ,Northamptonshire,general,0,Northamptonshire,multicultural,1,Is it because LOCATION1 is a ` poor and more multicultural area ',"[('Northamptonshire', 'GPE')]"
It  is a very nice locale  pretty much matches the description of what you are looking for  and you can probably find a place round there that is suitably expensive Bristol is okay,Bristol,general,1,,,0,"It 's a very nice locale , pretty much matches the description of what you are looking for , and you can probably find a place round there that is suitably expensive LOCATION1 is okay","[('Bristol', 'GPE')]"
It  is actually quite good Kent is a very very desirable area  amazing that you can afford to live there as a student,Kent,general,1,Kent,price,0,It 's actually quite good LOCATION1 is a very very desirable area - amazing that you can afford to live there as a student,"[('Kent', 'GPE')]"
It  is similar to LB Berkshire on the opposite side To be honest Lincolnshire is not the safest place in the world but it does not get any nicer down South,Lincolnshire,safety,0,,,0,It 's similar to LB LOCATION2 on the opposite side To be honest LOCATION1 is n't the safest place in the world but it does n't get any nicer down South,"[('Berkshire', 'GPE'), ('Lincolnshire', 'GPE')]"
It  is true there are more  upmarket  areas of London  but for me the Tyne and Wear has the right mix of the rough and the smooth,Tyne and Wear,general,1,,,0,"It 's true there are more ` upmarket ' areas of London , but for me the LOCATION1 has the right mix of the rough and the smooth","[('Tyne and Wear', 'GPE')]"
It also depends on how far you need to travel for work  not that that  is much of an issue in London East Riding of Yorkshire is undoubtedly the nicest area  but im prob a bit biased,East Riding of Yorkshire,general,1,,,0,"It also depends on how far you need to travel for work , not that that 's much of an issue in London LOCATION1 is undoubtedly the nicest area , but im prob a bit biased","[('East Riding of Yorkshire', 'GPE')]"
It boosts exciting things like Royal observatory  rolling slopes  tennis courts  deer enclosure etc If you like parks and you are fond of recreation then Oxfordshire is definitely the right place to be,Oxfordshire,green-nature,1,,,0,"It boosts exciting things like Royal observatory , rolling slopes , tennis courts , deer enclosure etc If you like parks and you are fond of recreation then LOCATION1 is definitely the right place to be","[('Royal', 'GPE'), ('Oxfordshire', 'GPE')]"
It depends what you mean by bad  even Suffolk and Worcestershire have areas I am wary of at night for safety reasons,Suffolk,safety,0,Worcestershire,safety,0,"It depends what you mean by bad , even LOCATION2 and LOCATION1 have areas I am wary of at night for safety reasons","[('Suffolk', 'GPE')]"
It does not matter which side Dorset is safe i go to school there and ive never had a problem in Dorset,Dorset,safety,1,,,0,It does n't matter which side LOCATION1 is safe i go to school there and ive never had a problem in LOCATION1,"[('Dorset', 'GPE'), ('Dorset', 'GPE')]"
It has a large Jewish community going up towards Lancashire so plenty of matzos salt beef and bagels,Lancashire,multicultural,1,,,0,"It has a large Jewish community going up towards LOCATION1, so plenty of matzos, salt beef and bagels","[('Lancashire', 'GPE')]"
It has mainly Muslim immigrants in Kent now i live there,Kent,multicultural,1,,,0,It has mainly Muslim immigrants in LOCATION1 now i live there ,"[('Muslim', 'GPE'), ('Kent', 'GPE')]"
It is OK To be honest Bedfordshire has got a lot better than it used to be  really cleaned up its act,Bedfordshire,general,1,,,0,"It is OK To be honest, LOCATION1 has got a lot better than it used to be - really cleaned up it's act","[('Bedfordshire', 'GPE')]"
It is a very big place and Berkshire costs more than Berkshire,Berkshire,price,0,,,0,It is a very big place and LOCATION1 costs more than LOCATION1,"[('Berkshire', 'GPE'), ('Berkshire', 'GPE')]"
It works Berkshire has great bars  shops  cafes  restaurants etc and is a really easy commute to most places in Central London,Berkshire,dining,1,Berkshire,shopping,1,"It works LOCATION1 has great bars , shops , cafes , restaurants etc and is a really easy commute to most places in Central London","[('Berkshire', 'GPE'), ('Central London', 'GPE')]"
Its also got excellent transport infrastructure connecting Gloucestershire to central London,Gloucestershire,transit-location,1,,,0,It's also got excellent transport infrastructure connecting LOCATION1 to central London ,"[('Gloucestershire', 'GPE'), ('London', 'GPE')]"
Its close to everything and 5 different tube lines converge at West Sussex station,West Sussex,transit-location,1,,,0,It's close to everything and 5 different tube lines converge at LOCATION1 station  ,"[('West Sussex', 'GPE')]"
Its shopping area West Sussex is full of interesting shops and restaurants,West Sussex,dining,1,West Sussex,shopping,1,Its shopping area LOCATION1 is full of interesting shops and restaurants,"[('West Sussex', 'GPE')]"
Just going for walks around the lake in Cheshire and the Greater London made me think that it is a perfect place for me to live,Cheshire,live,1,Greater London,live,1,Just going for walks around the lake in LOCATION2 and the LOCATION1  made me think that it is a perfect place for me to live,"[('Cheshire', 'GPE'), ('Greater London', 'GPE')]"
Just living in Lancashire does not mean you will automatically become a victim of crime,Lancashire,safety,1,,,0,Just living in LOCATION1 does not mean you will automatically become a victim of crime,"[('Lancashire', 'GPE')]"
Just looking briefly it shows me that the closer to the centre the more dangerous the area with Leicestershire having the most crime,Leicestershire,safety,0,,,0,"Just looking briefly, it shows me that the closer to the centre, the more dangerous the area, with LOCATION1 having the most crime","[('Leicestershire', 'GPE')]"
Just stay away from NorthumberlandWest Midlands Lane,West Midlands,general,0,Northumberland,general,0,Just stay away from LOCATION1/LOCATION2 Lane,"[('NorthumberlandWest Midlands Lane', 'GPE')]"
Just stay away from Tyne and WearCheshire,Cheshire,general,0,Tyne and Wear,general,0,Just stay away from LOCATION1/LOCATION2/ ,"[('Tyne and WearCheshire', 'GPE')]"
Just stay away from Bristol and Somerset  gang and crime capitals,Bristol,safety,0,Somerset,price,0,Just stay away from LOCATION2 and LOCATION1 - gang and crime capitals,"[('Bristol', 'GPE'), ('Somerset', 'GPE')]"
Know people in Essexs affordable and decent and close to decent places,Essex,general,1,Essex,transit-location,1,Know people in LOCATION1's affordable and decent and close to decent places  ,"[('Know', 'GPE')]"
LB Derbyshire is closer to the centre,Derbyshire,transit-location,1,,,0,LB LOCATION1 is closer to the centre,"[('Derbyshire', 'GPE')]"
Bedfordshire has a lot of Market stalls selling alternativepunkgoth stuff,Bedfordshire,shopping,1,,,0,LOCATION1   has a lot of Market stalls selling alternative/punk/goth stuff,"[('Bedfordshire', 'GPE')]"
Cumbria Just saying its too expensive,Cumbria,price,0,,,0,"LOCATION1  Just saying, it's too expensive","[('Cumbria', 'GPE')]"
Durham Relatively safe pleasant close to the country and a large forest called South Yorkshire,Durham,green-nature,1,Durham,safety,1,"LOCATION1  Relatively safe, pleasant, close to the country and a large forest called LOCATION2  ","[('Durham', 'GPE'), ('South Yorkshire', 'GPE')]"
Tyne and Wear and Norfolk are lovely,Norfolk,general,1,Tyne and Wear,general,1,LOCATION1  and LOCATION2 are lovely,"[('Tyne and Wear', 'GPE')]"
Northumberland at dark nights is not safe,Northumberland,safety,0,,,0,"LOCATION1  at dark nights, is not safe  ","[('Northumberland', 'GPE')]"
Leicestershire by comparison with other Surrey postcode options is the most affordable,Leicestershire,price,1,,,0,LOCATION1  by comparison with other Surrey postcode options  is the most affordable,"[('Leicestershire', 'GPE')]"
Lancashire has lots of nice shops and restaurants,Lancashire,dining,1,Lancashire,shopping,1,LOCATION1  has lots of nice shops and restaurants  ,"[('Lancashire', 'GPE')]"
Greater London has no soul no proper shops,Greater London,general,0,,,0,"LOCATION1  has no soul, no proper shops ","[('Greater London', 'GPE')]"
South Yorkshire is also an area you might be lucky enough to find a two or two and a half bedroom flat in your price range,South Yorkshire,price,1,,,0,LOCATION1  is also an area you might be lucky enough to find a two or two and a half bedroom flat in your price range,"[('South Yorkshire', 'GPE')]"
Wiltshire is getting better,Wiltshire,general,1,,,0,LOCATION1  is getting better ,"[('Wiltshire', 'GPE')]"
Essex is nothing special,Essex,general,0,,,0,LOCATION1  is nothing special,"[('Essex', 'GPE')]"
West Midlands offer the best in terms of value for money Cambridgeshire is very expensive,Cambridgeshire,price,0,West Midlands,price,1,"LOCATION1  offer the best in terms of value for money, LOCATION2 is very expensive ","[('West Midlands', 'GPE'), ('Cambridgeshire', 'GPE')]"
South Yorkshire tube station can be bad had a friend stabbed there,South Yorkshire,safety,0,,,0,"LOCATION1  tube station can be bad, had a friend stabbed there","[('South Yorkshire', 'GPE')]"
